{
  "calibration": {
    "arms": {
      "aggregate-predictive": {
        "allocation_delta_vs_fifo": {
          "equal_window_count": 1,
          "max": 0.003562721,
          "mean": -0.015253923,
          "median": -0.002554176,
          "min": -0.050330622,
          "negative_window_count": 3,
          "positive_window_count": 2
        },
        "allocation_rate_mean": {
          "max": 0.995788708,
          "mean": 0.759361334,
          "median": 0.774176588,
          "min": 0.474797921
        },
        "deterministic_window_count": 6,
        "failed_hard_constraint_window_counts": {
          "allocation-fifo-nondegradation": 3,
          "hp-p95-queue-seconds": 1
        },
        "hard_slo_pass_count": 2,
        "hard_slo_pass_rate": 0.333333333,
        "hp_jct_p95_seconds": {
          "max": 274979.8,
          "mean": 70608.375,
          "median": 31295.875,
          "min": 15128.9
        },
        "spot_eviction_rate_per_run": {
          "max": 0.067567568,
          "mean": 0.011261261,
          "median": 0.0,
          "min": 0.0
        },
        "spot_guarantee_success_rate": {
          "max": 1.0,
          "mean": 1.0,
          "median": 1.0,
          "min": 1.0
        },
        "spot_jct_p95_seconds": {
          "max": 2402254.05,
          "mean": 520391.783333333,
          "median": 44430.35,
          "min": 17165.15
        },
        "window_count": 6
      },
      "fifo": {
        "allocation_delta_vs_fifo": {
          "equal_window_count": 6,
          "max": 0.0,
          "mean": 0.0,
          "median": 0.0,
          "min": 0.0,
          "negative_window_count": 0,
          "positive_window_count": 0
        },
        "allocation_rate_mean": {
          "max": 0.995737905,
          "mean": 0.774615257,
          "median": 0.796579807,
          "min": 0.474797921
        },
        "deterministic_window_count": 6,
        "failed_hard_constraint_window_counts": {
          "hp-p95-queue-seconds": 1
        },
        "hard_slo_pass_count": 5,
        "hard_slo_pass_rate": 0.833333333,
        "hp_jct_p95_seconds": {
          "max": 281199.4,
          "mean": 76457.891666667,
          "median": 37404.55,
          "min": 15128.9
        },
        "spot_eviction_rate_per_run": {
          "max": 0.0,
          "mean": 0.0,
          "median": 0.0,
          "min": 0.0
        },
        "spot_guarantee_success_rate": {
          "max": 1.0,
          "mean": 1.0,
          "median": 1.0,
          "min": 1.0
        },
        "spot_jct_p95_seconds": {
          "max": 63491.4,
          "mean": 32340.083333333,
          "median": 20712.775,
          "min": 15190.2
        },
        "window_count": 6
      },
      "guarded-static": {
        "allocation_delta_vs_fifo": {
          "equal_window_count": 3,
          "max": 0.000968261,
          "mean": 0.000369147,
          "median": 0.000256014,
          "min": 0.0,
          "negative_window_count": 0,
          "positive_window_count": 3
        },
        "allocation_rate_mean": {
          "max": 0.996706165,
          "mean": 0.774984404,
          "median": 0.796579807,
          "min": 0.474797921
        },
        "deterministic_window_count": 6,
        "failed_hard_constraint_window_counts": {
          "hp-p95-queue-seconds": 1
        },
        "hard_slo_pass_count": 5,
        "hard_slo_pass_rate": 0.833333333,
        "hp_jct_p95_seconds": {
          "max": 281199.4,
          "mean": 71743.808333333,
          "median": 31592.375,
          "min": 15128.9
        },
        "spot_eviction_rate_per_run": {
          "max": 0.081632653,
          "mean": 0.033518154,
          "median": 0.021276596,
          "min": 0.0
        },
        "spot_guarantee_success_rate": {
          "max": 1.0,
          "mean": 1.0,
          "median": 1.0,
          "min": 1.0
        },
        "spot_jct_p95_seconds": {
          "max": 87365.6,
          "mean": 37439.65,
          "median": 20712.775,
          "min": 15190.2
        },
        "window_count": 6
      },
      "tenant-predictive": {
        "allocation_delta_vs_fifo": {
          "equal_window_count": 2,
          "max": 0.006285898,
          "mean": -0.011289167,
          "median": 0.0,
          "min": -0.050330622,
          "negative_window_count": 2,
          "positive_window_count": 2
        },
        "allocation_rate_mean": {
          "max": 0.995788708,
          "mean": 0.76332609,
          "median": 0.784709265,
          "min": 0.474797921
        },
        "deterministic_window_count": 6,
        "failed_hard_constraint_window_counts": {
          "allocation-fifo-nondegradation": 2,
          "hp-p95-queue-seconds": 1
        },
        "hard_slo_pass_count": 3,
        "hard_slo_pass_rate": 0.5,
        "hp_jct_p95_seconds": {
          "max": 274979.8,
          "mean": 70608.375,
          "median": 31295.875,
          "min": 15128.9
        },
        "spot_eviction_rate_per_run": {
          "max": 0.081632653,
          "mean": 0.026425955,
          "median": 0.0,
          "min": 0.0
        },
        "spot_guarantee_success_rate": {
          "max": 1.0,
          "mean": 1.0,
          "median": 1.0,
          "min": 1.0
        },
        "spot_jct_p95_seconds": {
          "max": 110374.5,
          "mean": 47797.8,
          "median": 23521.7,
          "min": 17165.15
        },
        "window_count": 6
      }
    },
    "selection": {
      "definition": "Arms must pass every hard SLO in every calibration window. Eligible arms follow the declared allocation, Spot JCT, and eviction hierarchy; unresolved ties remain parallel.",
      "selected_arm_ids": [],
      "selection_fingerprint": "d3ae60cc850ab571f03910913be7cdd73d85b6f9b1802691b5e6ee10261c5a8d",
      "stages": [
        {
          "remaining_arm_ids": [],
          "stage": "all_window_hard_slo_filter"
        }
      ],
      "status": "no_eligible_arm",
      "weighted_score_used": false
    },
    "summary_fingerprint": "77e47828e57a036629a6693d6c2ca9a73fcdbbb0591918ef8e3b10dfadb58151"
  },
  "holdout": {
    "arms": {
      "aggregate-predictive": {
        "allocation_delta_vs_fifo": {
          "equal_window_count": 0,
          "max": -0.016195353,
          "mean": -0.021199118,
          "median": -0.021297883,
          "min": -0.024956435,
          "negative_window_count": 5,
          "positive_window_count": 0
        },
        "allocation_rate_mean": {
          "max": 0.824861219,
          "mean": 0.689627214,
          "median": 0.779625116,
          "min": 0.467918833
        },
        "deterministic_window_count": 5,
        "failed_hard_constraint_window_counts": {
          "allocation-fifo-nondegradation": 5
        },
        "hard_slo_pass_count": 0,
        "hard_slo_pass_rate": 0.0,
        "hp_jct_p95_seconds": {
          "max": 616868.1,
          "mean": 162582.55,
          "median": 55782.0,
          "min": 39099.75
        },
        "spot_eviction_rate_per_run": {
          "max": 0.015873016,
          "mean": 0.003174603,
          "median": 0.0,
          "min": 0.0
        },
        "spot_guarantee_success_rate": {
          "max": 1.0,
          "mean": 1.0,
          "median": 1.0,
          "min": 1.0
        },
        "spot_jct_p95_seconds": {
          "max": 2034749.85,
          "mean": 974425.4,
          "median": 962663.3,
          "min": 27153.8
        },
        "window_count": 5
      },
      "fifo": {
        "allocation_delta_vs_fifo": {
          "equal_window_count": 5,
          "max": 0.0,
          "mean": 0.0,
          "median": 0.0,
          "min": 0.0,
          "negative_window_count": 0,
          "positive_window_count": 0
        },
        "allocation_rate_mean": {
          "max": 0.849817654,
          "mean": 0.710826332,
          "median": 0.795820469,
          "min": 0.489216716
        },
        "deterministic_window_count": 5,
        "failed_hard_constraint_window_counts": {},
        "hard_slo_pass_count": 5,
        "hard_slo_pass_rate": 1.0,
        "hp_jct_p95_seconds": {
          "max": 616868.1,
          "mean": 162582.55,
          "median": 55782.0,
          "min": 39099.75
        },
        "spot_eviction_rate_per_run": {
          "max": 0.0,
          "mean": 0.0,
          "median": 0.0,
          "min": 0.0
        },
        "spot_guarantee_success_rate": {
          "max": 1.0,
          "mean": 1.0,
          "median": 1.0,
          "min": 1.0
        },
        "spot_jct_p95_seconds": {
          "max": 32612.75,
          "mean": 25534.54,
          "median": 25384.4,
          "min": 19001.3
        },
        "window_count": 5
      },
      "guarded-static": {
        "allocation_delta_vs_fifo": {
          "equal_window_count": 3,
          "max": 0.000788487,
          "mean": 0.000164782,
          "median": 0.0,
          "min": 0.0,
          "negative_window_count": 0,
          "positive_window_count": 2
        },
        "allocation_rate_mean": {
          "max": 0.849853076,
          "mean": 0.710991113,
          "median": 0.795820469,
          "min": 0.489216716
        },
        "deterministic_window_count": 5,
        "failed_hard_constraint_window_counts": {},
        "hard_slo_pass_count": 5,
        "hard_slo_pass_rate": 1.0,
        "hp_jct_p95_seconds": {
          "max": 616868.1,
          "mean": 162582.55,
          "median": 55782.0,
          "min": 39099.75
        },
        "spot_eviction_rate_per_run": {
          "max": 0.074626866,
          "mean": 0.020639659,
          "median": 0.0,
          "min": 0.0
        },
        "spot_guarantee_success_rate": {
          "max": 1.0,
          "mean": 1.0,
          "median": 1.0,
          "min": 1.0
        },
        "spot_jct_p95_seconds": {
          "max": 32612.75,
          "mean": 25643.85,
          "median": 25500.5,
          "min": 19001.3
        },
        "window_count": 5
      },